page_id,page_name,political_category,status_id,status_message,link_name,status_type,status_link,status_published,num_reactions,num_comments,num_shares,num_likes,num_loves,num_wows,num_hahas,num_sads,num_angrys,total_engagement
24674986856,Michael Moore,left,24674986856_10153913074756857,"Morning After To-Do List:
1. Take over the Democratic Party and return it to the people. They have failed us miserably. 
2. Fire all pundits, predictors, pollsters and anyone else in the media who had a narrative they wouldn't let go of and refused to listen to or acknowledge what was really going on. Those same bloviators will now tell us we must ""heal the divide"" and ""come together."" They will pull more hooey like that out of their ass in the days to come. Turn them off. 
3. Any Democratic member of Congress who didn't wake up this morning ready to fight, resist and obstruct in the way Republicans did against President Obama every day for eight full years must step out of the way and let those of us who know the score lead the way in stopping the meanness and the madness that's about to begin. 
4. Everyone must stop saying they are ""stunned"" and ""shocked"". What you mean to say is that you were in a bubble and weren't paying attention to your fellow Americans and their despair. YEARS of being neglected by both parties, the anger and the need for revenge against the system only grew. Along came a TV star they liked whose plan was to destroy both parties and tell them all ""You're fired!"" Trump's victory is no surprise. He was never a joke. Treating him as one only strengthened him. He is both a creature and a creation of the media and the media will never own that. 
5. You must say this sentence to everyone you meet today: ""HILLARY CLINTON WON THE POPULAR VOTE!"" The MAJORITY of our fellow Americans preferred Hillary Clinton over Donald Trump. Period. Fact. If you woke up this morning thinking you live in an effed-up country, you don't. The majority of your fellow Americans wanted Hillary, not Trump. The only reason he's president is because of an arcane, insane 18th-century idea called the Electoral College. Until we change that, we'll continue to have presidents we didn't elect and didn't want. You live in a country where a majority of its citizens have said they believe there's climate change, they believe women should be paid the same as men, they want a debt-free college education, they don't want us invading countries, they want a raise in the minimum wage and they want a single-payer true universal health care system. None of that has changed. We live in a country where the majority agree with the ""liberal"" position. We just lack the liberal leadership to make that happen (see: #1 above). 

Let's try to get this all done by noon today. 
     -- Michael Moore",,status,,2016-11-09 10:13:39,475996,24740,210566,427307,37176,1024,1268,8158,1063,711302
22067606728,Allen West,right,22067606728_10153884804456729,"Yippee, the Confederate battle flag has now been removed from the grounds of the South Carolina State Capitol. And, just like that, it solves the problem of black-on-black crime and killings. Now we'll see the out-of-wedlock birthrate in the black community drop from 75%. There will be better educational opportunities and schools in South Carolina's black communities and all across America. The black unemployment rate will drop —especially the almost 40% black teenage unemployment rate. We'll now see an economic entrepreneurial boon in the inner cities because the Confederate battle flag's been lowered. And there'll be no more gangs of blacks beating on whites — as we saw in Ohio recently. Yep, the liberal progressive media shouted ""squirrel"" and an entire nation went a running. All the yelling and shouting by the crowds was evidence of those who lack grace, respect and dignity. Former South Carolina Gamecocks football coach Lou Holtz remarked that when you get to the end zone, you should act like you've been there before. So what does the lowering of the Confederate battle flag have to do with the killing of little seven-year-old Amari Brown in Chicago — anyone know when his funeral is?",,status,,2015-07-10 09:54:36,200183,21297,139410,200183,0,0,0,0,0,360890
136264019722601,Rush Limbaugh,right,136264019722601_1485967638085559,"We have a guy, Donald Trump. He's an A-list celebrity, rich and famous, who's been surrounded by beautiful women all over the world for 30 years.  Not once in 30 years has any of these women claimed he assaulted 'em.  Yeah, that only happened three weeks before a presidential election in which he is running.  Same thing with Trump and racism. For 30 years in public life, nobody's ever called him a racist until he ran for president.",,status,,2016-10-14 12:02:08,169254,9192,127496,158004,4401,744,421,516,5168,305942
22067606728,Allen West,right,22067606728_10153841087716729,"President Obama is on his way to Charleston SC to deliver the eulogy at the funeral services for slain Pastor and State Senator Clementa Pinckney of the Emanuel AME Church. My thoughts and prayers go out to the Pinckney family. However, I just have to ask one question, why did President Obama not deliver the eulogy at the funeral of US Navy SEAL Chris Kyle whose service to our nation and to fellow veterans is legendary?",,status,,2015-06-26 13:30:00,172103,21430,41210,172103,0,0,0,0,0,234743
22067606728,Allen West,right,22067606728_10154063744061729,"Today in Irving, Texas, 14-year-old MacArthur High School student Ahmed Mohamed was arrested for bringing a homemade clock to school that officials felt resembled a ""hoax bomb."" He will not face charges, but officials took what they deemed were necessary precautions. President Obama took to Twitter to support the young man and has invited him to the White House.

How many children of slain law enforcement officers has President Obama invited to the White House? Just asking.",,status,,2015-09-16 17:05:00,111340,19265,70009,111340,0,0,0,0,0,200614
15704546335,Fox News,right,15704546335_10154964008326336,"Breaking News: Ford Motor Company, a target of criticism from President-elect Donald J. Trump over its intentions to invest in Mexico, says it is cancelling its plans to build a factory there and will invest $700 million at a Michigan factory. http://fxn.ws/2ivzf7r",,status,,2017-01-03 11:30:44,153268,5511,41232,135328,13802,3571,475,29,63,200011
346937065399354,Occupy Democrats,left,346937065399354_1308612895898428,"""I listened as they called my President a Muslim (as if it were a bad thing). I listened as they called him a monkey. I listened as they said he wasn't born here. I watched as they blocked every single path to progress that they could. I saw the pictures of him as Hitler. I listened as they openly said that they will oppose him at every turn. I watched as they did just that. I listened and I watched and I paid attention. Now, I'm being called on to be tolerant. To move forward. To denounce protesters. To ""Get over it."" To accept this...
I will not. I will do my part to make sure this great American mistake becomes the embarrassing footnote of our history that it deserves to be, as quickly as possible. I will do my part to limit the damage that this man can do to my country. I will vote. I will watch his every move and point out every single mistake and misdeed in a loud and proud voice. Do not call for my tolerance. I've tolerated all I can. Now it's their turn to tolerate ridicule. Be aware, make no mistake about it, every single thing that goes wrong in our country from this day forward is now Trump's fault just as much as they thought it was Obama's. I find it unreasonable for them to expect from me what they were entirely unwilling to give.
They will find no shelter here."" 

- Jeremy Zabel",,status,,2016-11-13 13:10:29,134896,8632,49493,112146,17518,565,240,3519,908,193021
15704546335,Fox News,right,15704546335_10152885286886336,"JUST IN: In a 237-190 vote, the House has voted to overturn President Obama's executive actions on immigration that extended protections to millions of people in the US illegally. http://fxn.ws/1zcqiCO",,status,,2015-01-14 11:51:32,152225,9266,30186,152225,0,0,0,0,0,191677
15704546335,Fox News,right,15704546335_10153846926981336,"DEVELOPING: Police in Honduras caught five Syrians who were trying to make their way to the United States with stolen and doctored passports, according to reports. http://fxn.ws/1S4MIvC",,status,,2015-11-18 15:21:54,83788,7502,94124,83788,0,0,0,0,0,185414
346937065399354,Occupy Democrats,left,346937065399354_1272197449539973,"""Bill Clinton cheats on his wife. Impeach him. Trump proudly brags about sexual assault (and has cheated on his wives). Elect him. Hillary oversaw the department of state while 4 people died in an embassy attack. Put her in jail. 2 Republicans were in office while over 200 people died in embassy attacks. No problem. Immigrants don't pay taxes. Round them up and kick them out. Trump doesn't pay taxes. He's a business genius. Hillary's foundation only spent 87% of their donations helping people. She's a crook. Trumps foundation paid off his debts, bought sculptures of him, and made political donations to avoid investigations while using less than 5% of funds for charity (and he got shut down by NY State). So savvy... Put him in the white house. Trump made 4 billion dollars in 40 years, when an index fund started at the same time with the same ""small loans"" he received would be worth $12 billion today... without a trail of bankruptcies, thousands of lawsuits and burned small business owners. He's a real business whiz. Hillary took a loss of $700k. She's a criminal. Trump is the first candidate in the modern era not to release his tax returns, and took a billion dollar loss in 1 year. Genius. Hillary takes responsibility for private email servers and apologizes. Not credible. Trump denies saying things (on the record) he actually said (on the record), he's just telling it like it is.

Your arguments are thin. Your ignorance of reality is shocking. Your double-standards are offensive, and your willingness to blindly support him and recycle the rhetoric is absurd. Your opinion is not fact. Your memes are not news articles. And your hypocrisy is not a platform.""

- Alex Schiller",,status,,2016-10-14 06:11:42,111111,5347,61235,94411,11629,953,295,392,3431,177693
15704546335,Fox News,right,15704546335_10152943750501336,Breaking News: GOP-led House votes 239-186 in favor of repealing ObamaCare. http://fxn.ws/1Kpc9TD,,status,,2015-02-03 17:21:53,143336,8498,20913,143336,0,0,0,0,0,172747
22067606728,Allen West,right,22067606728_10154325068511729,"OK, call me what you want, but if it were President West, tonight's State of the Union address would have been cancelled. We have 10 American sailors being held by Iran -- that would be my priority. But I suppose the priority for a narcissist is himself. Then again, if it were a President West, there would be no Iranian nuclear deal, nor would they even dream of detaining our sailors.",,status,,2016-01-12 21:00:00,125294,7927,25087,125294,0,0,0,0,0,158308
24674986856,Michael Moore,left,24674986856_10154174797131857,"Stunning bombshell right now from the New York Times -- Trump campaign chair, campaign officials and Trump associates made repeated contacts and calls with Russian intelligence during the YEAR leading up to the election. 

It's what we all suspected. It doesn't take a rocket scientist to figure out what was going on: TRUMP COLLUDING WITH THE RUSSIANS TO THROW THE ELECTION TO HIM. 

So this is what I want done NOW: 

1. I and tens of millions of Americans demand that the weak and spineless Democrats bring Congress to a halt until investigative hearings are held and impeachment charges are filed. We don't want to hear you Dems huff and puff and grandstand and take symbolic actions. We demand that you halt all actions being taken by an illegitimately elected government until this matter is resolved. 

2. Attorney General J Beauregard Sessions must immediately appoint a Special Prosecutor to investigate these potentially treasonous acts. 

3. So-Called President Trump could save the country a lot of time, money and pain by stepping down tonight. 

4. Somehow, our judicial system has to find a way to make restitution to this country. Pence can't be president as he, too, was elected under this same fraud. The court has to rule either that the President is the winner of  the popular vote OR the election must be held over. The Republicans-- the beneficiaries of this treason --cannot be allowed to hold on to the power by default. If it turns out there's a traitor in the White House, the judicial branch must find a fair, peaceful way to un-do and then re-do the election of 2016.",,status,,2017-02-14 21:50:12,102692,8677,36749,85717,4141,5574,555,257,6448,148118
24674986856,Michael Moore,left,24674986856_10153915876426857,"Day Two's To-Do List:
1. Must quickly and decisively form an opposition movement, the likes of which hasn't been seen since the 1960s. I will do my part to help lead this as I'm sure many others (Bernie, Elizabeth Warren, MoveOn, the hip-hop community, DFA, etc.) will, too. The core of this opposition force will be fueled by young people who, as with Occupy Wall Street and Black Lives Matter, don't tolerate b.s. and are relentless in their resistance to authority. They have no interest in compromising with racists and misogynists.

2. Prepare to impeach Trump. Just as the Republicans were already planning to do with President Hillary from Day One, we must organize the apparatus that will bring charges against him when he violates his oath and breaks the law -- and then we must remove him from office.

3. Must commit right now to a vigorous fight (including civil disobedience, if necessary) which will block any and all Donald Trump Supreme Court nominees who do not meet our approval. We demand the Democrats in the Senate aggressively filibuster any nominees who support Citizens United or who oppose the rights of women, immigrants and the poor. This is non-negotiable. 

4. Demand the DNC apologize to Bernie Sanders for trying to fix the primaries against him, for spinning the press to ignore his historic campaign, for giving Clinton the questions in advance at the Flint debate, for its latent ageism and anti-Semism in trying to turn voters against him because of his age or religious beliefs, and for its anti-democracy system of ""superdelegates"" who are elected by no one. We all know now had Bernie been given a fair shot, he probably would have been the nominee and he -- as the true outsider and ""change"" candidate --would have inspired and fired up the base and soundly defeated Donald Trump. If no apology is soon forthcoming from the DNC, that's ok -- when we take over the Democratic Party (see yesterday's To-Do List, #1), we will issue the apology in person. 

5. Demand that President Obama establish a Special Prosecutor to investigate who and what was behind FBI Director James Comey's illegal interference into the Presidential election 11 days before the vote was held. 

6. Begin a national push while it's fresh in everyone's mind for a constitutional amendment to fix our broken electoral system: 1. Eliminate the Electoral College -- popular vote only. 2. Paper ballots only -- no electronic voting. 3. Election Day must be made a holiday for all -- or held on a weekend so more people vote.  4. All citizens, regardless of any run-ins with the criminal ""justice"" system, must have the right to vote. (In swing states like Florida and Virginia, 30-40% of all Black men are prohibited by law from voting.)

7. Convince President Obama to immediately do what he should have done a year ago: Send in the Army Corps of Engineers to Flint to dig up and replace all the poisoned pipes. NOTHING HAS CHANGED; the water in Flint is still unusable. 

Will try to get these done by sundown. More To-Do tomorrow...
    --Michael Moore",,status,,2016-11-10 11:57:32,97471,11120,30274,84125,11685,339,1013,81,228,138865
15704546335,Fox News,right,15704546335_10154149665396336,"Statement from a FOX News spokesperson:
 
""Donald Trump's vitriolic attacks against Megyn Kelly and his extreme, sick obsession with her is beneath the dignity of a presidential candidate who wants to occupy the highest office in the land. Megyn is an exemplary journalist and one of the leading anchors in America — we're extremely proud of her phenomenal work and continue to fully support her throughout every day of Trump's endless barrage of crude and sexist verbal assaults. As the mother of three young children, with a successful law career and the second highest rated show in cable news, it's especially deplorable for her to be repeatedly abused just for doing her job.""",,status,,2016-03-18 19:50:00,69097,49371,11864,59870,3506,407,3315,215,1784,130332
24674986856,Michael Moore,left,24674986856_10153534565891857,"My favorite Muhammad Ali moment (when asked if he would ""serve"" in Vietnam):

""Why should they ask me to put on a uniform and go 10,000 miles from home and drop bombs and bullets on Brown people in Vietnam while so-called Negro people in Louisville are treated like dogs and denied simple human rights? No I'm not going 10,000 miles from home to help murder and burn another poor nation simply to continue the domination of white slave masters of the darker people the world over. This is the day when such evils must come to an end. I have been warned that to take such a stand would cost me millions of dollars. But I have said it once and I will say it again. The real enemy of my people is here. I will not disgrace my religion, my people or myself by becoming a tool to enslave those who are fighting for their own justice, freedom and equality…. If I thought the war was going to bring freedom and equality to 22 million of my people they wouldn't have to draft me, I'd join tomorrow. I have nothing to lose by standing up for my beliefs. So I'll go to jail, so what? We've been in jail for 400 years.""

After taking this stand and refusing to be drafted into the US Army, Ali was arrested, convicted as a felon, stripped of his boxing title, prohibited from boxing anywhere and given a prison sentence for refusing to go to Vietnam. He appealed it all the way to the Supreme Court where he won. 

This is the kind of selfless, courageous action we are sorely missing today. Who amongst us would risk EVERYTHING for what we believe in, for doing what we know in our hearts is right?

It's never too late.",,status,,2016-06-04 10:57:11,96551,1717,26209,86744,8878,669,31,202,27,124477
136264019722601,Rush Limbaugh,right,136264019722601_1267609773254681,"You look at Ted Cruz, you look at Marco Rubio, you look at Dr. Ben Carson. You have two Hispanics and an African-American getting 60% of the caucus votes.  Over on the Democrat side, two bedraggled, worn out old white people were the choice.  And we sit here, we continue to have to listen to all this garbage that the Republican Party is where you find a lack of diversity and closed-minded bigotry.",,status,,2016-02-02 12:33:54,86013,2536,30819,86013,0,0,0,0,0,119368
15704546335,Fox News,right,15704546335_10155138782961336,"BREAKING NEWS: The Trump administration lifts federal guidelines that said transgender students should be allowed to use public school bathrooms and locker rooms matching their chosen gender identity.

Details: http://fxn.ws/2lx2V3q",,status,,2017-02-22 19:18:51,90906,6375,10965,76980,10722,233,1407,340,1224,108246
24674986856,Michael Moore,left,24674986856_10154133500006857,"A big, loud protest has formed out of nowhere at JFK Airport's Terminal 4 in NYC! Hundreds have shown up to join them to protest Trump's racist Muslim ban. Inside, Homeland Security has detained people because of their religion or because they come from a Muslim-majority country. Some of those detained have an American Green Card! Do you want to let Trump take us to war against the entire Muslim world? Because that's where this is heading, my friends. Who here wants to die for Donald J. Trump? Please - if u are in the New York area, stop what you're doing right now and head to JFK Terminal 4. If you live near other cities with International airports, go there and do the same. Let's jam these airports immediately! Spread the word!  #NoMuslimBanJFK",,status,,2017-01-28 15:41:58,82927,2940,19704,69587,6540,716,84,968,5032,105571
22067606728,Allen West,right,22067606728_10154326377196729,"I just saw the video, released by Iran, of our US Sailors kneeling with their hands behind their heads on their assault boats. This was a seizure, an act of war, and what were the rules of engagement (ROE) that precluded our Sailors from defending themselves? The engines reported malfunctioned, am I to assume the weapons aboard the riverine assault craft malfunctioned as well? Ladies and gents, the Iranians just completely embarrassed America, and Obama is about to give them $150 billion. FUBAR!",,status,,2016-01-13 11:45:00,64914,5994,32995,64914,0,0,0,0,0,103903
136264019722601,Rush Limbaugh,right,136264019722601_1507888739226782,"I want to tell those of you still on the fence: The reason Hillary Clinton set up that private server was to make sure that any Freedom of Information Act request of the State Department would not reveal what she's doing, because the real news is that she and her husband were selling U.S. foreign policy.  Foreign entities, foreign governments, foreign wealthy individuals were paying big money for that.  That's what she was hiding; that's what's being investigated.",,status,,2016-11-03 13:02:35,57521,2341,43619,48240,412,1926,117,230,6596,103481
15704546335,Fox News,right,15704546335_10154189846221336,"A new policy went into effect in Mississippi requiring residents to work or volunteer 20 hours a week to qualify for food stamps.

Do you think there should be work requirements for food stamp recipients?",,status,,2016-03-30 15:05:07,73795,8941,19446,69752,3404,104,459,17,59,102182
136264019722601,Rush Limbaugh,right,136264019722601_1474189532596703,"Okay, so Trump's business lost some money.  We can see Trump's business lost some money.  Hillary Clinton as secretary of state lost four people in Benghazi, including our ambassador.  Hillary Clinton loses people.  Trump lost some money.  His own, by the way, not yours.",,status,,2016-10-03 11:47:35,65458,2713,33413,61620,2515,189,367,78,689,101584
24674986856,Michael Moore,left,24674986856_10154107292186857,"WHOA! Just heard -- ROBERT DE NIRO will be speaking at our anti-Trump rally tonight!! Huge crowds expected in front of Trump Hotel on Central Park West & 61st St!! 6pm sharp!! Be there! Everyone welcome. The city that produced Trump will raise its voice tonight, the final night before the madness begins. We need everyone there at 6pm. Also slated to speak: Alec Baldwin, Rosie Perez, Mark Ruffalo, Cynthia Nixon, Al Sharpton, Shailene Woodley, Julianne Moore, Marisa Tomei, myself, and the Mayor of New York.",,status,,2017-01-19 12:55:54,85145,4488,9212,72246,10416,1912,300,57,214,98845
22067606728,Allen West,right,22067606728_10154847986521729,"News flash!! ISIS has SURRENDERED. After hearing Paul Simon's rendition of ""Bridge Over Troubled Water"" at #DNCinPHL, their eyes are filled with tears, and their hearts are overflowing with love and compassion. Yes! You can all go to sleep tonight knowing the Democrats have made the world SAFE again. Kumbaya y'all.",,status,,2016-07-25 21:10:00,76348,3910,17769,48612,1414,221,25927,72,102,98027
15704546335,Fox News,right,15704546335_10152860538871336,"Attention DISH customers: DISH Network has dropped Fox News Channel and Fox Business Network from your channel lineup. DISH is refusing to respond to Fox News, leaving you without our programming. If you would like to watch America's #1 cable news channel, find another TV provider in your area by visiting www.KeepFoxNews.com.",,status,,2015-01-06 15:51:47,66028,16788,13435,66028,0,0,0,0,0,96251
