page_id,page_name,political_category,status_id,status_message,link_name,status_type,status_link,status_published,num_reactions,num_comments,num_shares,num_likes,num_loves,num_wows,num_hahas,num_sads,num_angrys,total_engagement
24674986856,Michael Moore,left,24674986856_10154095395841857,"Here's why Congressman and civil rights legend John Lewis is right that Trump ""is not a legitimate President"":

1. Nothing, including an arcane, racist section of the constitution, can change the fact that 3 million more Americans voted for Hillary than for Trump. It's either a democracy or it isn't. If he had won by 3 million, I would sadly admit that Trump is the President the American people wanted. But that's not what happened. 

2. He is not well and needs help. He has a number of serious mental disorders that make him unfit to hold office -- and they are on display every day in one cringe-worthy tweet after another. He is a full-blown malignant narcissist. He displays sociopathic tendencies. He will say one thing and 30 seconds later say the opposite. He is disconnected from the truth. And he has a stunning lack of human empathy. These behaviors make him a truly dangerous occupant of the Oval Office.

3. The Russians interfered with the election in order to get him elected. Even Trump now admits as much. That alone makes the election tainted and should be voided. We spend trillions on ridiculous weapons and ineffective police state-style homeland security measures to defend us against those who would ""destroy our way of life"" -- but we are to remain silent when a foreign government is caught trying to get THEIR candidate elected as OUR president? AND they succeed! This is a joke of monstrous proportions -- and the fact that conservatives, Republicans and patriotic good ol' boys are actively defending this foreign aggression into our country confirms to me what I've feared all along: that they really hate our form of democracy, our Bill of Rights, our belief that ""All men (sic) are created equal,"" our one person-one vote system, that whoever scores the most points wins and that people of all religions are welcome here. They don't believe that, and I'd respect them so much more if they would just simply admit it.  

4. The FBI clearly chose sides, and FBI Director Comey's interference in the 10 days before the election most-definitely helped tipped the balance to the FBI's preferred candidate, Donald J. Trump. That our own federal police would so brazenly attempt to throw the election to the person with the least votes is mind-boggling, frightening and must be stopped. Attorney General Lynch must immediately, today, appoint a Special Prosecutor to investigate what to me appears to be a criminal offense. If this is true, I want to see FBI Director Comey in handcuffs and behind bars. Short of murder and a few other heinous acts, is there a worse crime in our democracy than the highest ranking cop in the land attempting to throw the election? 

5. Trump has nominated in Rex Tillerson the most powerful corporate CEO in the world as ""our"" Secretary of State. Why would the quarter-billionaire head of the world's richest corporation want a ""government job?"" So that he, a personal friend of Putin's, can get the US sanctions lifted off Russia so that his company, ExxonMobil, can get back to their exclusive oil deal with Russia -- which will eventually net ExxonMobil three TRILLION dollars. This is nothing less than a bold, audacious robbery in broad daylight -- and it says a lot about you and me that they think they can get away with it. 

6. Trump has potentially committed a number of felonies -- and a felon simply can't sit in the Oval Office (I can't believe I even have to state that). From his admitted sexual assaults to whatever he's hiding in the tax returns, to possibly evading taxes, to his committing fraud with Trump U, to his long list of conflicts of interest -- the chance of us having to suffer through his impeachment trial in the Senate is just too much to bear. 

Donald Trump is, as John Lewis said, NOT a legitimate president. He is unfit, unstable and was elected with help from the Russian government. John Lewis has announced he will not attend the Inauguration, and eight other members of Congress today have joined him. Call (202-225-3121) or write your Congressperson and insist he or she not attend the swearing in of an illegitimate president. It's the least you can do short of standing in front of this runaway train.  -- Michael Moore",,status,,2017-01-14 16:10:23,66228,4227,25565,57807,5049,296,175,530,2371,96020
24674986856,Michael Moore,left,24674986856_10154024054456857,"1. Hello rest of the world! My fellow Americans are asleep right now so I thought we could talk privately and maybe I can explain what happened yesterday. 

2. Hillary Clinton won the election on Nov 8 by 2.8 million votes over Donald Trump. Which is to say, she lost. You are correct, this is not a democracy. 

3. Back in the 1700s, in order to get the slave states to join the USA, the founders gave those states ""extra votes"", letting them count their slaves but not let them vote. 

4. So yes, it is ironic that this racist idea called the Electoral College has, 225 years later, ended up benefiting the candidate who spewed racism hate.

5. Trump is not president until he's given the oath of office at noon on Jan 20th. So we will continue to fight and hope to find a legal, nonviolent way to stop this madness. 

6. Ok, people are starting to wake up in the US. I wish I could give u better news. As bad as it seems, I'm sorry to tell you, it will be worse. We are a broken country at this point.",,status,,2016-12-20 05:02:00,64636,6500,20010,43388,661,514,380,15177,4516,91146
15704546335,Fox News,right,15704546335_10153258738296336,"Breaking News: U.S. commandos kill an ISIS leader, Abu Sayyaf, in a raid in eastern Syria, officials say. No U.S. personnel were injured. http://fxn.ws/1HjIvj4",,status,,2015-05-16 08:02:51,79564,2986,7684,79564,0,0,0,0,0,90234
16307558831,Mark Levin,right,16307558831_10153448650518832,"I'm calling on NBC to fire Al Sharpton, whose words & actions for decades have been hateful & demeaning",,status,,2015-06-30 12:36:48,77624,3907,8451,77624,0,0,0,0,0,89982
22067606728,Allen West,right,22067606728_10153382869856729,"I'm not going to force you to endure a rehash of the presidents's State of the Union Address.If you watched it, you endured enough. He said we have eliminated torture - except for those of us who sat through it. it. But I do have a question regarding his comment that climate change is the biggest threat we face. When did climate change ever behead an American?",,status,,2015-01-21 07:12:12,70644,4476,13914,70644,0,0,0,0,0,89034
22067606728,Allen West,right,22067606728_10155084787936729,"Is it just me but has anyone noticed that the left and some coward Republicans are in a tizzy about a taped private conversation of Donald Trump eleven years ago, but the progressive socialists of the left attacked the group that videotaped Planned Parenthood employees talking about killing babies and selling their body parts? And to think that group was taken to court because of the method they used, but we still had federal government funding for killing our unborn. Or why is there such outrage about Trump's words but society says nothing about the sexually explicit and denigrating language of rappers, some of whom Barack Obama has invited into the White House? The hypocrisy is laughable and only those stuck on stupid would vote for a person who should be in jail and her rapist husband  -- who, if you don't recall, inserted a cigar into a 19-year-old female.",,status,,2016-10-11 10:56:44,56641,3027,29062,49270,1731,517,93,474,4556,88730
136264019722601,Rush Limbaugh,right,136264019722601_1506792682669721,"Something Obama said at Chapel Hill: ""If Trump's elected, he'll reverse every single thing I've done on jobs, on health insurance, climate change."" Yeah, that's kind of the idea, is to reverse everything you've done and more.",,status,,2016-11-02 14:36:17,72427,2519,11910,64020,4461,106,3737,22,81,86856
136264019722601,Rush Limbaugh,right,136264019722601_1515555055126817,"There are people protesting, yeah, and they're burning flags, yeah. But they're being paid to do it, and it's made to look like this country is fed up with Donald Trump already.  It's made to look like this country is livid and outraged over the election result, when it isn't.  The country is happy!  We are ecstatic over the outcome of the election.  It's the left that it isn't happy.",,status,,2016-11-10 14:04:25,63866,2770,19531,58288,3463,191,325,188,1411,86167
15704546335,Fox News,right,15704546335_10155022965596336,"Breaking News: In his first hours as president, Donald J. Trump signs executive orders mandating a regulatory freeze and directing federal agencies to ""ease the burden"" of ObamaCare. http://fxn.ws/2jJrsUx",,status,,2017-01-20 19:27:36,71586,2673,10410,62539,7996,220,590,59,182,84669
22067606728,Allen West,right,22067606728_10153417588826729,"Yesterday President Obama met with American Muslim leaders whose names the White House would not disclose -- so much for transparency in the House for which the taxpayers pay the bill. But do the secular humanists and radical atheists not see this as a violation of separation of church and state? Oops, I guess the operative word is ""church""...mosque and state is cool. Now ask yourself, when was the last time American Christian, or even Jewish leaders were invited to a White House meeting? And no, Rev. Al Sharpton does not count. By the way, for all my dear liberal progressive socialist fans, just how much does Rev. Al owe in taxes? So many pertinent questions in just one little FB post.",,status,,2015-02-05 08:16:46,58440,4811,19446,58440,0,0,0,0,0,82697
136264019722601,Rush Limbaugh,right,136264019722601_1516851131663876,"I tell you what, Donald Trump just made a brilliant move.  He removed Governor Christie as head of his transition team and put Mike Pence in there.  Mike Pence is in charge of the transition.  There are 4,000 jobs that need to be filled in these next 73 days, and having Mike Pence lead that effort is some of the best news we could have today.",,status,,2016-11-11 14:47:33,72108,1906,5811,67378,4392,243,59,20,16,79825
24674986856,Michael Moore,left,24674986856_10154172832531857,"My thoughts on the resignation of National Security Advisor Michael Flynn...

Now that Flynn is gone, he can rejoin his son in pedaling the story that Hillary was running a pedophile ring out of Comet Pizza. This is what was passing for National Security. Whackjob...

I'm fondly remembering Michael Flynn at the Republican convention leading the cheer from the stage: ""LOCK HER UP!"" Now it may be him who gets locked up. Be careful what you wish for!...

Flynn was colluding with a foreign government accused of helping throw the election to Trump, promising them they would be taken care of. Arrest him...

Let's be VERY clear: Flynn DID NOT make that Russian call on his own. He was INSTRUCTED to do so.He was TOLD to reassure them. Arrest Trump...

TRUMP KNEW EVERYTHING. It will all come out. Along with the rest of Trump's collusion & obedience to Putin. #IMPEACH...

The Washington Post & NY Times now reporting Trump HAS KNOWN FOR A MONTH Flynn lied about the Russian call - and Trump did nothing. #IMPEACH...

This is who Trump named ""National Security Advisor"": A lapdog to the lapdog of Putin. Feeling secure America? He's gonna get u killed...

Hey, @realDonaldTrump -- one hour after Obama put sanctions on Russia YOU told Flynn to call them & promise them it'll be OK. Admit it. Traitor! Resign by morning!",,status,,2017-02-14 06:57:14,58305,3130,17839,49561,3258,728,306,186,4266,79274
15704546335,Fox News,right,15704546335_10155189669156336,"Breaking News: Attorney General Jeff Sessions has formally requested the resignations of the 46 remaining presidentially appointed US Attorneys, a Dept. of Justice spokeswoman said. http://fxn.ws/2lM1phv",,status,,2017-03-10 15:31:41,65055,6862,7041,52946,8378,2356,1074,36,265,78958
22067606728,Allen West,right,22067606728_10155096038286729,"Hypocrisy Alert! President Obama took the stage yesterday to mock the GOP as the party of ""family values."" Really, Barry? OK, you wanna talk about John F. Kennedy and Marilyn Monroe? Or how about the ""Lion of the Democrat Party,"" Ted Kennedy and a place called Chappaquiddick? And what shall we say about one William Jefferson Clinton and his exploits to include those right there in the Oval Office? Do you like cigars, Barack? And Sir, Mr. President, I say that quite tongue in cheek. The rappers you've invited to the White House, surely positive role models for family values, wouldn't you say?

Look, Barack ol' cheeky fella, you make this just too easy for me. Since Roe v Wade, more than 13 million black babies have been murdered in the womb, and you, Sir, sponsored legislation in Illinois that a child surviving an abortion still deserves to die. And you know that venerable foundational entity called the black family, well, thanks to the family values of Lyndon Johnson and his ill-conceived support of out-of-wedlock births, we only have 24% two-parent households in the black community. So Barry, go ahead, and make your jokes before the unenlightened masses of the new American socialist p
arty…knowing this simple fact, your Choom Gang has no values at all.",,status,,2016-10-14 19:00:00,54172,2624,21906,47643,3637,701,1568,148,475,78702
22067606728,Allen West,right,22067606728_10155181513301729,"Today is the day America can end the Clinton Crime Cartel. This is the day the Lord has made and it is ours, the American people, Judgment Day against the criminality, corruption, corporate cronyism, and the political, media, academic, cultural, and entertainment elites who are destroying the foundations of our constitutional republic. We, the American patriots, were made for a time such as this! God Bless America. #DrainTheSwamp",,status,,2016-11-08 09:18:46,62024,1432,14309,56631,5213,38,42,75,25,77765
15704546335,Fox News,right,15704546335_10153426060271336,"BREAKING: The man arrested in connection with the seemingly random killing of a woman on the San Francisco waterfront is an illegal immigrant who previously had been deported five times, federal immigration officials say. http://fxn.ws/1R9Owae",,status,,2015-07-03 12:57:44,36273,13422,26036,36273,0,0,0,0,0,75731
136264019722601,Rush Limbaugh,right,136264019722601_1287523951263263,Ted Cruz is not a liar. He's not a nasty guy. He is one of the most honorable people in politics that so far has not been corrupted by it.,,status,,2016-03-01 16:10:25,57934,4890,12268,54788,2507,52,424,19,144,75092
24674986856,Michael Moore,left,24674986856_10154136800651857,"Thank you to all who stood up this weekend for those whom others seek to harm. With no planning, no organization, no funding and no meetings, tens of thousands of Americans, on their own, just showed up at their airports, their local portal to rest of planet earth, and said loud and clear, ""NO. Not in our America. We are the majority. You will not diminish our values, you will not degradate our fellow human beings. We welcome all."" Let's keep our voice alive and strong, every single day, every single one of us.",,status,,2017-01-29 23:26:00,69428,1453,4059,61154,8039,126,55,14,40,74940
24674986856,Michael Moore,left,24674986856_10153216698941857,"Mr. Trump -- Please keep calling them ""dames,"" keep calling for a wall and banning Mexicans and Muslims, and keep being uncool -- because women, minorities, and young adults (18-35) make up 81% of the eligible voters next year. EIGHTY-ONE PERCENT! You've succeeded in offending and alienating each one of these groups. Your fatal political mistake is that you think America looks like you. It doesn't. Only 19% of the voting public are white guys like you over the age of 35. A small minority. You're about to learn it doesn't feel good to be a minority in this country. But you'll survive. Because you're also in another minority -- billionaires. You'll be fine.",,status,,2016-01-02 18:04:59,62239,2438,9965,62239,0,0,0,0,0,74642
15704546335,Fox News,right,15704546335_10154733573186336,"Breaking News: Defense Secretary Ash Carter announces Pentagon will suspend 'all efforts' to collect reimbursement from as many as 2,000 California National Guard soldiers overpaid in reenlistment bonuses nearly a decade ago. http://fxn.ws/2ffB2gl",,status,,2016-10-26 09:33:34,54694,4715,14687,49721,4256,432,75,24,186,74096
24674986856,Michael Moore,left,24674986856_10153140950126857,"Dear Gov. Snyder:

I just wanted to let you know that, contrary to your declaration of denying Syrian refugees a home in our state of Michigan, I myself am going to defy your ban and will offer MY home in Traverse City, Michigan, to those very Syrian refugees you've decided to keep out. I will contact the State Department to let them know I am happy to provide a safe haven to any Syrian refugee couple approved by the Obama administration's vetting procedures in which I have full faith and trust. 

Your action is not only disgraceful, it is, as you know, unconstitutional (only the President has the legal right to decide things like this).

What you've done is anti-American. This is not who we are supposed to be. We are, for better and for worse, a nation of descendants of three groups: slaves from Africa who were brought here in chains and then forced to provide trillions of dollars of free labor to build this country; native peoples who were mostly exterminated by white Christians through acts of mass genocide; and immigrants from EVERYWHERE around the globe. In Michigan we are fortunate to count amongst us tens of thousands of Arab and Muslim Americans. 

I'm disappointed in you, Governor Snyder, for your heartless and un-Christian actions, and for joining in with at least 25 other governors (all but one a Republican) who've decided to block legal Syrian refugees from coming into their states. Fortunately I'm an American and not a Republican.    

Governor, count me out of whatever you think it means to be a Michigander. I look forward to welcoming Syrians to my home and I wholeheartedly encourage other Americans to do the same. 

Michael Moore

P.S. By the way, my 700-sq. ft. apartment in northern Michigan is a little small, but it's got cable, wi-fi and a new dishwasher! Also, no haters live on my floor! Stop by any time for a hot chocolate this winter.",,status,,2015-11-20 05:47:14,57036,3727,13067,57036,0,0,0,0,0,73830
24674986856,Michael Moore,left,24674986856_10154106129641857,"ACTION ALERT! TONIGHT (THURSDAY) at 6pm a whole bunch of us -- Alec Baldwin, Mark Ruffalo, Rosie Perez, the Mayor of New York, Natalie Merchant, myself and others -- are holding a big, massive rally against Trump in New York City in front of the Trump Hotel on Columbus Circle, 61st & Central Park West. We're gonna kick off the First One Hundred Days of Resistance. Let's pack the streets tonight (Thurs) and send Trump a strong message. 6PM!!! Be there!!!",,status,,2017-01-19 00:43:30,60751,3597,8983,52653,6868,749,255,45,181,73331
24674986856,Michael Moore,left,24674986856_10154159464691857,"Throughout my life I have watched Senators speak vile, hateful words about women, Black people, Vietnamese, Mexicans, young people, Arabs, environmentalists, peaceniks, gays and others -- but NEVER have I seen them vote to shut a single one of them up. Until last night, when Senator Elizabeth Warren attempted to read a letter from the late Coretta Scott King addressed to the United States Senate. That's when Warren was ruled to shut up and sit down. And when she appealed, the Republicans voted to silence her under ""Rule 19."" This morning you need to once again flood the Senate switchboard with angry, righteous calls demanding that the Senate take the virtual gag off her and let her speak. If we let them get away with this... you know what's coming. They are attempting to create an authoritarian, totalitarian state. If you've been hiding in your bubble, it's best to come out now. US Senate: 202-225-3121 or 202-224-3121. Keep dialing like your democracy depends on it. Let them know we are a large, massive, outraged nonviolent mob representing the majority of our country and we will not be Rule 19'd. We will Rule 19 them out of office! They need to know that the Women's March on Washington NEVER ends. Be sure to tell your Senator he/she better vote down Jefferson Sessions  for Attorney General, too.",,status,,2017-02-08 09:08:53,52178,2905,18005,37813,984,437,82,2629,10233,73088
24674986856,Michael Moore,left,24674986856_10153884940061857,"Unless the emails show Hillary lit a forest fire, has been running Halliburton, or is responsible for the Galaxy 7, I don't give a rats' ass.",,status,,2016-10-29 15:44:33,61975,2501,8007,51091,4170,82,6465,33,134,72483
